{
  "$schema": "https://json-schema.org/draft/2020-12/schema",
  "$id": "https://github.com/egeria-corporation/grantcheck/schema/report-1.0.json",
  "title": "grantcheck report, schema version 1.0",
  "description": "The output of `grantcheck --format json` and of the hosted /api/check/{ein} endpoint. Within major version 1, changes are additive only: keys may be added, never renamed, removed, or redefined. An unknown value is null and never an empty string, because an empty string reads as 'we looked and found nothing', which is a different claim from 'we did not look'.",
  "type": "object",
  "required": [
    "schema_version",
    "ein",
    "queried_at",
    "organization",
    "checks",
    "readiness",
    "blocking_check_ids",
    "opportunities",
    "vintages",
    "disclosure",
    "notes"
  ],
  "additionalProperties": true,
  "properties": {
    "schema_version": {
      "type": "string",
      "pattern": "^1\\.[0-9]+$",
      "description": "Major.minor. Consumers should pin the major version."
    },
    "ein": {
      "type": "string",
      "pattern": "^[0-9]{2}-[0-9]{7}$",
      "description": "Formatted with the hyphen. This is the canonical display form."
    },
    "queried_at": {
      "type": "string",
      "format": "date-time",
      "description": "When this report was produced, UTC, ISO 8601."
    },
    "readiness": {
      "type": "string",
      "enum": ["ready", "attention", "blocked", "not_found"],
      "description": "'blocked' means a mechanical hard stop was observed, not that we judged the organization ineligible. An 'unknown' check never produces 'blocked'."
    },
    "blocking_check_ids": {
      "type": "array",
      "items": { "type": "string" },
      "description": "Ids of checks that failed and are blocking, in registry order."
    },
    "disclosure": {
      "type": "string",
      "minLength": 1,
      "description": "Required verbatim text. Present in every report in every format."
    },
    "notes": {
      "type": "array",
      "items": { "type": "string" },
      "description": "Caveats about how this report was produced, such as an inferred SAM.gov match or a stale cached index."
    },
    "organization": {
      "description": "Identity as the IRS has it, or null when the EIN is not in the index.",
      "oneOf": [
        { "type": "null" },
        {
          "type": "object",
          "required": ["ein", "name"],
          "properties": {
            "ein": { "type": "string", "pattern": "^[0-9]{2}-[0-9]{7}$" },
            "name": { "type": "string" },
            "sort_name": { "type": ["string", "null"] },
            "city": { "type": ["string", "null"] },
            "state": { "type": ["string", "null"] },
            "ntee_code": { "type": ["string", "null"] },
            "subsection": { "type": ["string", "null"] },
            "classification": { "type": ["string", "null"] },
            "foundation_code": { "type": ["string", "null"] },
            "group_exemption": { "type": ["string", "null"] },
            "ruling_date": {
              "type": ["string", "null"],
              "description": "YYYY-MM. The Business Master File carries month precision only; a full date here would invent a day the source never claimed."
            },
            "uei": { "type": ["string", "null"] }
          }
        }
      ]
    },
    "checks": {
      "type": "array",
      "items": {
        "type": "object",
        "required": ["id", "label", "group", "status", "blocking", "value", "detail", "vintage", "confidence"],
        "properties": {
          "id": {
            "type": "string",
            "description": "Stable snake_case identifier. Part of the public contract; renaming one is a breaking change."
          },
          "label": { "type": "string" },
          "group": {
            "type": "string",
            "enum": ["tax_exemption", "filing_health", "federal_registration", "audit_posture"]
          },
          "status": {
            "type": "string",
            "enum": ["pass", "warn", "fail", "unknown", "not_applicable"],
            "description": "'not_applicable' means the check does not apply to this organization, which is different from 'unknown', meaning we could not determine it."
          },
          "blocking": {
            "type": "boolean",
            "description": "Whether a 'fail' here mechanically prevents submission. True on a non-failing check simply describes the check's nature."
          },
          "value": { "type": ["string", "null"] },
          "detail": { "type": ["string", "null"] },
          "confidence": {
            "type": ["number", "null"],
            "minimum": 0,
            "maximum": 1,
            "description": "Present only where a fact was inferred rather than looked up."
          },
          "vintage": { "$ref": "#/$defs/vintage" }
        }
      }
    },
    "vintages": {
      "type": "array",
      "items": { "$ref": "#/$defs/vintage" },
      "description": "Every dataset this report drew on, with the date its source declares."
    },
    "opportunities": {
      "description": "Null unless OpenGrants enrichment ran. An empty array means it ran and matched nothing.",
      "oneOf": [
        { "type": "null" },
        {
          "type": "array",
          "items": {
            "type": "object",
            "required": ["id", "title"],
            "properties": {
              "id": { "type": "string" },
              "title": { "type": "string" },
              "funder": { "type": ["string", "null"] },
              "deadline": { "type": ["string", "null"], "format": "date" },
              "url": { "type": ["string", "null"] },
              "amount": { "type": ["string", "null"] }
            }
          }
        }
      ]
    }
  },
  "$defs": {
    "vintage": {
      "description": "When the SOURCE says its data was published, not when we downloaded it.",
      "oneOf": [
        { "type": "null" },
        {
          "type": "object",
          "required": ["dataset", "published", "source_url"],
          "properties": {
            "dataset": {
              "type": "string",
              "enum": ["bmf", "pub78", "revocation", "epostcard", "efile_index", "sam", "fac"]
            },
            "published": { "type": "string", "format": "date" },
            "source_url": { "type": "string" }
          }
        }
      ]
    }
  }
}
